{
  "rule_id": "gitleaks:generic-api-key",
  "ebene": "B",
  "schwere": "K",
  "achse": "sicherheit",
  "titel": "Zugangsschlüssel im Klartext",
  "erklaerung": "Im Code steht ein Schlüssel, der wie ein echter API-Schlüssel aussieht. Wer das Paket erhält, kann ihn nutzen.",
  "datei": "src/config.py",
  "zeile": 3,
  "beleg": "API_KEY = \"sk-t…\"",
  "nachweisgrad": "statisch_erkannt",
  "normbezug": ["OWASP-LLM02"],
  "fix": "Schlüssel widerrufen und aus einer Umgebungsvariable lesen.",
  "fix_prompt": "Ersetze in src/config.py den fest eingetragenen API_KEY durch os.environ[\"API_KEY\"] und ergänze .env.example.",
  "fingerprint": "3f1c0a9e5b7d2c4e6f8a0b1c2d3e4f5a6b7c8d9e0f1a2b3c4d5e6f7a8b9c0d1e"
}
